{
  "description": "USN-5807-1 fixed vulnerabilities in libXpm. This update provides the\ncorresponding updates for Ubuntu 16.04 ESM.\n\nOriginal advisory details:\n\n Martin Ettl discovered that libXpm incorrectly handled certain XPM files.\n If a user or automated system were tricked into opening a specially crafted\n XPM file, a remote attacker could possibly use this issue to cause libXpm\n to stop responding, resulting in a denial of service. (CVE-2022-44617)\n\n Marco Ivaldi discovered that libXpm incorrectly handled certain XPM files.\n If a user or automated system were tricked into opening a specially crafted\n XPM file, a remote attacker could possibly use this issue to cause libXpm\n to stop responding, resulting in a denial of service. (CVE-2022-46285)\n\n Alan Coopersmith discovered that libXpm incorrectly handled calling\n external helper binaries. If libXpm was being used by a setuid binary, a\n local attacker could possibly use this issue to escalate privileges.\n (CVE-2022-4883)\n",
  "releases": {
    "xenial": {
      "allbinaries": {
        "xpmutils": {
          "pocket": "esm-infra",
          "source": "libxpm",
          "version": "1:3.5.11-1ubuntu0.16.04.1+esm1"
        },
        "libxpm-dev": {
          "pocket": "esm-infra",
          "source": "libxpm",
          "version": "1:3.5.11-1ubuntu0.16.04.1+esm1"
        },
        "libxpm4": {
          "pocket": "esm-infra",
          "source": "libxpm",
          "version": "1:3.5.11-1ubuntu0.16.04.1+esm1"
        }
      },
      "binaries": {
        "xpmutils": {
          "pocket": "esm-infra",
          "version": "1:3.5.11-1ubuntu0.16.04.1+esm1"
        },
        "libxpm4": {
          "pocket": "esm-infra",
          "version": "1:3.5.11-1ubuntu0.16.04.1+esm1"
        }
      },
      "sources": {
        "libxpm": {
          "version": "1:3.5.11-1ubuntu0.16.04.1+esm1",
          "description": "X11 pixmap library"
        }
      }
    }
  },
  "title": "libXpm vulnerabilities",
  "timestamp": 1676972506.66655,
  "summary": "libxpm vulnerabilities",
  "action": "After a standard system update you need to restart your session to make all\nthe necessary changes.\n",
  "cves": [
    "CVE-2022-44617",
    "CVE-2022-46285",
    "CVE-2022-4883"
  ],
  "id": "USN-5807-2",
  "isummary": "Several security issues were fixed in libXpm.\n"
}
