{
  "action": "After a standard system update you need to reboot your computer to make\nall the necessary changes.\n\nATTENTION: Due to an unavoidable ABI change the kernel updates have\nbeen given a new version number, which requires you to recompile and\nreinstall all third party kernel modules you might have installed.\nUnless you manually uninstalled the standard kernel metapackages\n(e.g. linux-generic, linux-generic-lts-RELEASE, linux-virtual,\nlinux-powerpc), a standard system upgrade will automatically perform\nthis as well.\n",
  "cves": [
    "CVE-2024-26595",
    "CVE-2024-26663",
    "CVE-2024-26929",
    "CVE-2024-38553",
    "CVE-2024-38597",
    "CVE-2024-38661",
    "CVE-2024-40982",
    "CVE-2024-41012",
    "CVE-2024-41020",
    "CVE-2024-41066",
    "CVE-2024-42252",
    "CVE-2024-42311",
    "CVE-2024-43914",
    "CVE-2024-53103",
    "CVE-2024-53141"
  ],
  "description": "Several security issues were discovered in the Linux kernel.\nAn attacker could possibly use these to compromise the system.\nThis update corrects flaws in the following subsystems:\n  - Multiple devices driver;\n  - Network drivers;\n  - Mellanox network drivers;\n  - S/390 drivers;\n  - SCSI subsystem;\n  - Sonic Silicon Backplane drivers;\n  - File systems infrastructure;\n  - Closures library;\n  - Netfilter;\n  - TIPC protocol;\n  - VMware vSockets driver;\n(CVE-2024-26929, CVE-2024-40982, CVE-2024-42311, CVE-2024-53141,\nCVE-2024-41066, CVE-2024-38661, CVE-2024-38553, CVE-2024-43914,\nCVE-2024-26663, CVE-2024-42252, CVE-2024-38597, CVE-2024-53103,\nCVE-2024-41020, CVE-2024-41012, CVE-2024-26595)\n",
  "id": "USN-7233-2",
  "isummary": "Several security issues were fixed in the Linux kernel.\n",
  "releases": {
    "bionic": {
      "allbinaries": {
        "linux-azure-4.15-cloud-tools-4.15.0-1185": {
          "pocket": "esm-infra",
          "source": "linux-azure-4.15",
          "version": "4.15.0-1185.200"
        },
        "linux-azure-4.15-headers-4.15.0-1185": {
          "pocket": "esm-infra",
          "source": "linux-azure-4.15",
          "version": "4.15.0-1185.200"
        },
        "linux-azure-4.15-tools-4.15.0-1185": {
          "pocket": "esm-infra",
          "source": "linux-azure-4.15",
          "version": "4.15.0-1185.200"
        },
        "linux-azure-lts-18.04": {
          "pocket": "esm-infra",
          "source": "linux-meta-azure-4.15",
          "version": "4.15.0.1185.153"
        },
        "linux-buildinfo-4.15.0-1185-azure": {
          "pocket": "esm-infra",
          "source": "linux-azure-4.15",
          "version": "4.15.0-1185.200"
        },
        "linux-cloud-tools-4.15.0-1185-azure": {
          "pocket": "esm-infra",
          "source": "linux-azure-4.15",
          "version": "4.15.0-1185.200"
        },
        "linux-cloud-tools-azure-lts-18.04": {
          "pocket": "esm-infra",
          "source": "linux-meta-azure-4.15",
          "version": "4.15.0.1185.153"
        },
        "linux-headers-4.15.0-1185-azure": {
          "pocket": "esm-infra",
          "source": "linux-azure-4.15",
          "version": "4.15.0-1185.200"
        },
        "linux-headers-azure-lts-18.04": {
          "pocket": "esm-infra",
          "source": "linux-meta-azure-4.15",
          "version": "4.15.0.1185.153"
        },
        "linux-image-4.15.0-1185-azure": {
          "pocket": "esm-infra",
          "source": "linux-signed-azure-4.15",
          "version": "4.15.0-1185.200"
        },
        "linux-image-azure-lts-18.04": {
          "pocket": "esm-infra",
          "source": "linux-meta-azure-4.15",
          "version": "4.15.0.1185.153"
        },
        "linux-image-unsigned-4.15.0-1185-azure": {
          "pocket": "esm-infra",
          "source": "linux-azure-4.15",
          "version": "4.15.0-1185.200"
        },
        "linux-modules-4.15.0-1185-azure": {
          "pocket": "esm-infra",
          "source": "linux-azure-4.15",
          "version": "4.15.0-1185.200"
        },
        "linux-modules-extra-4.15.0-1185-azure": {
          "pocket": "esm-infra",
          "source": "linux-azure-4.15",
          "version": "4.15.0-1185.200"
        },
        "linux-modules-extra-azure-lts-18.04": {
          "pocket": "esm-infra",
          "source": "linux-meta-azure-4.15",
          "version": "4.15.0.1185.153"
        },
        "linux-signed-azure-lts-18.04": {
          "pocket": "esm-infra",
          "source": "linux-meta-azure-4.15",
          "version": "4.15.0.1185.153"
        },
        "linux-signed-image-azure-lts-18.04": {
          "pocket": "esm-infra",
          "source": "linux-meta-azure-4.15",
          "version": "4.15.0.1185.153"
        },
        "linux-tools-4.15.0-1185-azure": {
          "pocket": "esm-infra",
          "source": "linux-azure-4.15",
          "version": "4.15.0-1185.200"
        },
        "linux-tools-azure-lts-18.04": {
          "pocket": "esm-infra",
          "source": "linux-meta-azure-4.15",
          "version": "4.15.0.1185.153"
        }
      },
      "binaries": {
        "linux-image-4.15.0-1185-azure": {
          "pocket": "esm-infra",
          "version": "4.15.0-1185.200"
        },
        "linux-image-azure-lts-18.04": {
          "pocket": "esm-infra",
          "version": "4.15.0.1185.153"
        }
      },
      "sources": {
        "linux-azure-4.15": {
          "description": "Linux kernel for Microsoft Azure Cloud systems",
          "version": "4.15.0-1185.200"
        }
      }
    },
    "trusty": {
      "allbinaries": {
        "linux-azure": {
          "pocket": "esm-infra-legacy",
          "source": "linux-meta-azure",
          "version": "4.15.0.1185.200~14.04.1"
        },
        "linux-azure-cloud-tools-4.15.0-1185": {
          "pocket": "esm-infra-legacy",
          "source": "linux-azure",
          "version": "4.15.0-1185.200~14.04.1"
        },
        "linux-azure-headers-4.15.0-1185": {
          "pocket": "esm-infra-legacy",
          "source": "linux-azure",
          "version": "4.15.0-1185.200~14.04.1"
        },
        "linux-azure-tools-4.15.0-1185": {
          "pocket": "esm-infra-legacy",
          "source": "linux-azure",
          "version": "4.15.0-1185.200~14.04.1"
        },
        "linux-buildinfo-4.15.0-1185-azure": {
          "pocket": "esm-infra-legacy",
          "source": "linux-azure",
          "version": "4.15.0-1185.200~14.04.1"
        },
        "linux-cloud-tools-4.15.0-1185-azure": {
          "pocket": "esm-infra-legacy",
          "source": "linux-azure",
          "version": "4.15.0-1185.200~14.04.1"
        },
        "linux-cloud-tools-azure": {
          "pocket": "esm-infra-legacy",
          "source": "linux-meta-azure",
          "version": "4.15.0.1185.200~14.04.1"
        },
        "linux-headers-4.15.0-1185-azure": {
          "pocket": "esm-infra-legacy",
          "source": "linux-azure",
          "version": "4.15.0-1185.200~14.04.1"
        },
        "linux-headers-azure": {
          "pocket": "esm-infra-legacy",
          "source": "linux-meta-azure",
          "version": "4.15.0.1185.200~14.04.1"
        },
        "linux-image-4.15.0-1185-azure": {
          "pocket": "esm-infra-legacy",
          "source": "linux-signed-azure",
          "version": "4.15.0-1185.200~14.04.1"
        },
        "linux-image-azure": {
          "pocket": "esm-infra-legacy",
          "source": "linux-meta-azure",
          "version": "4.15.0.1185.200~14.04.1"
        },
        "linux-image-unsigned-4.15.0-1185-azure": {
          "pocket": "esm-infra-legacy",
          "source": "linux-azure",
          "version": "4.15.0-1185.200~14.04.1"
        },
        "linux-modules-4.15.0-1185-azure": {
          "pocket": "esm-infra-legacy",
          "source": "linux-azure",
          "version": "4.15.0-1185.200~14.04.1"
        },
        "linux-modules-extra-4.15.0-1185-azure": {
          "pocket": "esm-infra-legacy",
          "source": "linux-azure",
          "version": "4.15.0-1185.200~14.04.1"
        },
        "linux-modules-extra-azure": {
          "pocket": "esm-infra-legacy",
          "source": "linux-meta-azure",
          "version": "4.15.0.1185.200~14.04.1"
        },
        "linux-signed-azure": {
          "pocket": "esm-infra-legacy",
          "source": "linux-meta-azure",
          "version": "4.15.0.1185.200~14.04.1"
        },
        "linux-signed-image-azure": {
          "pocket": "esm-infra-legacy",
          "source": "linux-meta-azure",
          "version": "4.15.0.1185.200~14.04.1"
        },
        "linux-tools-4.15.0-1185-azure": {
          "pocket": "esm-infra-legacy",
          "source": "linux-azure",
          "version": "4.15.0-1185.200~14.04.1"
        },
        "linux-tools-azure": {
          "pocket": "esm-infra-legacy",
          "source": "linux-meta-azure",
          "version": "4.15.0.1185.200~14.04.1"
        }
      },
      "binaries": {
        "linux-image-4.15.0-1185-azure": {
          "pocket": "esm-infra-legacy",
          "version": "4.15.0-1185.200~14.04.1"
        },
        "linux-image-azure": {
          "pocket": "esm-infra-legacy",
          "version": "4.15.0.1185.200~14.04.1"
        }
      },
      "sources": {
        "linux-azure": {
          "description": "Linux kernel for Microsoft Azure Cloud systems",
          "version": "4.15.0-1185.200~14.04.1"
        }
      }
    }
  },
  "summary": "linux-azure, linux-azure-4.15 vulnerabilities",
  "timestamp": 1738263102.1910853,
  "title": "Linux kernel (Azure) vulnerabilities"
}
