{
  "description": "It was discovered that devscripts incorrectly handled certain YAML files.\nAn attacker could possibly use this to execute arbitrary code.\n",
  "releases": {
    "bionic": {
      "allbinaries": {
        "devscripts": {
          "pocket": "security",
          "version": "2.17.12ubuntu1.1"
        }
      },
      "binaries": {
        "devscripts": {
          "pocket": "security",
          "version": "2.17.12ubuntu1.1"
        }
      },
      "archs": {
        "amd64": {
          "urls": {
            "http://security.ubuntu.com/ubuntu/pool/main/d/devscripts/devscripts_2.17.12ubuntu1.1_amd64.deb": {
              "size": 870376,
              "md5": "cbed8084d6224effb1d897b8559855dd"
            }
          }
        },
        "source": {
          "urls": {
            "http://security.ubuntu.com/ubuntu/pool/main/d/devscripts/devscripts_2.17.12ubuntu1.1.tar.xz": {
              "size": 712624,
              "md5": "686692ae8421726bb7e8ffdef060ab36"
            },
            "http://security.ubuntu.com/ubuntu/pool/main/d/devscripts/devscripts_2.17.12ubuntu1.1.dsc": {
              "size": 2713,
              "md5": "4fb0cbc35dc50a8f2fc63362f080af93"
            }
          }
        },
        "s390x": {
          "urls": {
            "http://ports.ubuntu.com/pool/main/d/devscripts/devscripts_2.17.12ubuntu1.1_s390x.deb": {
              "size": 870364,
              "md5": "c066bbf69873b377f340557626a647d7"
            }
          }
        },
        "ppc64el": {
          "urls": {
            "http://ports.ubuntu.com/pool/main/d/devscripts/devscripts_2.17.12ubuntu1.1_ppc64el.deb": {
              "size": 870732,
              "md5": "86a0f8586127ba14c3f1603bdff3fa88"
            }
          }
        },
        "i386": {
          "urls": {
            "http://security.ubuntu.com/ubuntu/pool/main/d/devscripts/devscripts_2.17.12ubuntu1.1_i386.deb": {
              "size": 870448,
              "md5": "b2fe263ce0d42c7312eecdf9c7addeaa"
            }
          }
        },
        "armhf": {
          "urls": {
            "http://ports.ubuntu.com/pool/main/d/devscripts/devscripts_2.17.12ubuntu1.1_armhf.deb": {
              "size": 870216,
              "md5": "2c7d021583194343a5b4872b8c7e13e1"
            }
          }
        },
        "arm64": {
          "urls": {
            "http://ports.ubuntu.com/pool/main/d/devscripts/devscripts_2.17.12ubuntu1.1_arm64.deb": {
              "size": 870220,
              "md5": "95fc25b41f20ca1d869da366e4d7167a"
            }
          }
        }
      },
      "sources": {
        "devscripts": {
          "version": "2.17.12ubuntu1.1",
          "description": "scripts to make the life of a Debian Package maintainer easier"
        }
      }
    },
    "artful": {
      "sources": {
        "devscripts": {
          "version": "2.17.9ubuntu0.1",
          "description": "scripts to make the life of a Debian Package maintainer easier"
        }
      },
      "binaries": {
        "devscripts": {
          "version": "2.17.9ubuntu0.1"
        }
      },
      "archs": {
        "amd64": {
          "urls": {
            "http://security.ubuntu.com/ubuntu/pool/main/d/devscripts/devscripts_2.17.9ubuntu0.1_amd64.deb": {
              "size": 846708,
              "md5": "297802bf8ef12ba3623ea2a5c8da26fc"
            }
          }
        },
        "source": {
          "urls": {
            "http://security.ubuntu.com/ubuntu/pool/main/d/devscripts/devscripts_2.17.9ubuntu0.1.tar.xz": {
              "size": 696484,
              "md5": "37eb51f77216ef84a539b3ebcc4fcff6"
            },
            "http://security.ubuntu.com/ubuntu/pool/main/d/devscripts/devscripts_2.17.9ubuntu0.1.dsc": {
              "size": 2476,
              "md5": "c5161271df31194b784a1e16602ca4cc"
            }
          }
        },
        "s390x": {
          "urls": {
            "http://ports.ubuntu.com/pool/main/d/devscripts/devscripts_2.17.9ubuntu0.1_s390x.deb": {
              "size": 846644,
              "md5": "275207781edac7038fa090f6539505d2"
            }
          }
        },
        "ppc64el": {
          "urls": {
            "http://ports.ubuntu.com/pool/main/d/devscripts/devscripts_2.17.9ubuntu0.1_ppc64el.deb": {
              "size": 847074,
              "md5": "4854d6781718937a449b72a5c94b35fc"
            }
          }
        },
        "i386": {
          "urls": {
            "http://security.ubuntu.com/ubuntu/pool/main/d/devscripts/devscripts_2.17.9ubuntu0.1_i386.deb": {
              "size": 846772,
              "md5": "914d5a0bc5d95f94caa554e9fe1cc52c"
            }
          }
        },
        "armhf": {
          "urls": {
            "http://ports.ubuntu.com/pool/main/d/devscripts/devscripts_2.17.9ubuntu0.1_armhf.deb": {
              "size": 846612,
              "md5": "63a2378ad09930aa02e21fbcf88b6aa0"
            }
          }
        },
        "arm64": {
          "urls": {
            "http://ports.ubuntu.com/pool/main/d/devscripts/devscripts_2.17.9ubuntu0.1_arm64.deb": {
              "size": 846556,
              "md5": "29e7a2d9f66efca7c21f33857c7aee87"
            }
          }
        }
      }
    }
  },
  "title": "devscripts vulnerability",
  "timestamp": 1530811565.798297,
  "summary": "devscripts vulnerability",
  "action": "In general, a standard system update will make all the necessary changes.\n",
  "cves": [
    "CVE-2018-13043"
  ],
  "id": "USN-3704-1",
  "isummary": "devscripts could be made to run arbitrary code if it received\na specially crafted YAML file.\n"
}
